{
  "ip_address": "8.8.8.8",
  "city": "Mountain View",
  "city_geoname_id": 5375480,
  "region": "California",
  "region_iso_code": "CA",
  "region_geoname_id": 5332921,
  "postal_code": "94043",
  "country": "United States",
  "country_code": "US",
  "country_geoname_id": 6252001,
  "country_is_eu": false,
  "continent": "North America",
  "continent_code": "NA",
  "continent_geoname_id": 6255149,
  "longitude": -122.0838,
  "latitude": 37.386,
  "security": "https://www.example.com",
  "timezone": "sample-value",
  "flag": "sample-value",
  "currency": "sample-value"
}